"title","year","president","st.flag","matchWords","word.count","stMatchRatio","eoMatches.out","eoMatches.in","link"
"Interagency Task Force on the Roles and Missions of the United States Coast Guard","1999","42-Clinton",TRUE,"__State__; __DOD__; __DOJ__; __DOC__; __DOL__; __DOT__; __EPA__; __OMB__; __NSC__; __CEQ__; __economy__; __technology__; __security__; __foreign__; __environment__; __budget__",799,0.00125156445556946,"","13138","http://www.presidency.ucsb.edu/ws/index.php?pid=57311"
"Executive Schedule","1978","39-Carter",TRUE,"__State__; __DOTr__; __DOD__; __DOJ__; __economy__; __USDA__; __DOC__; __DOL__; __health__; __education__; __science/research__; __DOT__; __OMB__; __security__; __DOI__; __GSA__",543,0.00184162062615101,"11861","12099; 12111; 12119; 12154","http://www.presidency.ucsb.edu/ws/index.php?pid=31207"
"Imposing Additional Sanctions With Respect to North Korea","2015","44-Obama",TRUE,"__economy__; __security__; __computing__; __foreign__; __DOTr__; __State__; __technology__",1152,0.00173611111111111,"13466; 13551; 13570","","http://www.presidency.ucsb.edu/ws/index.php?pid=108103"
"The President's Committee for Traffic Safety","1960","34-Eisenhower",TRUE,"__science/research__; __education__; __DOC__",511,0.00195694716242661,"","10898; 10968; 11382","http://www.presidency.ucsb.edu/ws/index.php?pid=106536"
"Accelerating Broadband Infrastructure Deployment","2012","44-Obama",TRUE,"__innovation__; __GSA__; __DHS__; __OSTP__; __DOD__; __DOI__; __USDA__; __DOC__; __DOT__; __VA__; __FCC__; __CEQ__; __security__; __environment__; __technology__; __State__; __OMB__; __budget__",1644,0.00304136253041363,"13604","","http://www.presidency.ucsb.edu/ws/index.php?pid=101030"
"Proliferation of Weapons of Mass Destruction","1998","42-Clinton",TRUE,"__economy__; __foreign__; __State__; __technology__; __DOTr__; __medical__; __nuclear__; __energy__",800,0.00875,"12938; 12735; 12730; 12924; 12930","13128; 13382","http://www.presidency.ucsb.edu/ws/index.php?pid=56382"
"Amendments to Regulations Relating to Commissioned Officers and Employees of the Public Health Service","1947","33-Truman",TRUE,"__health__; __foreign__; __medical__; __education__; __science/research__; __war__",1991,0.00150678051230537,"9655","9993","http://www.presidency.ucsb.edu/ws/index.php?pid=78142"
"Statistical Policy Functions","1977","39-Carter",TRUE,"__budget__; __OMB__; __DOC__; __economy__; __State__; __DOTr__; __DOD__; __DOJ__; __DOI__; __USDA__; __DOL__; __health__; __education__; __HUD__; __DOT__; __DOE__",1088,0.000919117647058824,"11541; 10253; 10033; 11961","12318","http://www.presidency.ucsb.edu/ws/index.php?pid=6774"
"Creating an Emergency Board to Investigate a Dispute Between the Pan American World Airways, Inc., and Certain of its Employees","1961","35-Kennedy",TRUE,"__engineering__",231,0.00432900432900433,"","10926; 12553","http://www.presidency.ucsb.edu/ws/index.php?pid=58857"
"Blocking the Property and Suspending Entry into the United States of Certain Persons With Respect to Grave Human Rights Abuses by the Governments of Iran and Syria Via Information Technology","2012","44-Obama",TRUE,"__technology__; __economy__; __computing__; __security__; __foreign__; __DOTr__; __State__; __war__",1607,0.00808960796515246,"12957; 13338","","http://www.presidency.ucsb.edu/ws/index.php?pid=100679"
"Regulations Related to Voiding or Rescission of Contracts","1983","40-Reagan",TRUE,"__DOD__; __GSA__; __NASA__",366,0.00273224043715847,"","","http://www.presidency.ucsb.edu/ws/index.php?pid=40731"
"Chesapeake Bay Protection and Restoration","2009","44-Obama",TRUE,"__health__; __economy__; __EPA__; __USDA__; __DOD__; __security__; __DHS__; __science/research__; __environment__; __budget__; __innovation__; __DOC__; __DOI__; __war__; __OMB__",2875,0.00452173913043478,"","","http://www.presidency.ucsb.edu/ws/index.php?pid=86151"
"Expanding Approved Stem Cell Lines in Ethically Responsible Ways","2007","43-G. W. Bush",TRUE,"__science/research__; __HHS__; __health__; __NIH__; __medical__; __nuclear__",892,0.0291479820627803,"","13505","http://www.presidency.ucsb.edu/ws/index.php?pid=75464"
"President's Management Improvement Council","1979","39-Carter",TRUE,"__OMB__; __university__; __GSA__",487,0.00205338809034908,"","12258","http://www.presidency.ucsb.edu/ws/index.php?pid=31348"
"Establishing the Federal Radiation Council","1959","34-Eisenhower",TRUE,"__DOD__; __DOC__; __health__; __education__; __AEC__; __OSTP__",334,0.00598802395209581,"","","http://www.presidency.ucsb.edu/ws/index.php?pid=106519"
"Regulations Governing Payment of Travel and Transportation Expenses of Civilian Officers and Employees of the United States When Transferred from One Official Station to Another for Permanent Duty","1946","33-Truman",TRUE,"__economy__; __DOD__; __foreign__; __State__; __computing__; __war__",2561,0.000390472471690746,"9743","10069; 10196; 10274; 10381; 10507; 9834; 9933; 9997","http://www.presidency.ucsb.edu/ws/index.php?pid=60710"
"Prevention, Control, and Abatement of Air and Water Pollution at Federal Facilities","1970","37-Nixon",TRUE,"__environment__; __health__; __education__; __DOI__; __CEQ__; __AEC__; __security__; __budget__; __OMB__; __USDA__",2024,0.000494071146245059,"11282; 11288","11752","http://www.presidency.ucsb.edu/ws/index.php?pid=105901"
"Global Disaster Information Network","2000","42-Clinton",TRUE,"__technology__; __foreign__; __DOC__; __NOAA__; __State__; __DOD__; __DOI__; __USDA__; __DOT__; __DOE__; __OMB__; __EPA__; __NASA__; __CIA__; __security__",1075,0.0111627906976744,"","13284","http://www.presidency.ucsb.edu/ws/index.php?pid=61645"
"Amendment of Executive Order No. 11025, Creating a Board of Inquiry to Report on a Labor Dispute Affecting the Aircraft Industry of the United States","1962","35-Kennedy",TRUE,"__engineering__; __foreign__",275,0.00363636363636364,"11025","12553","http://www.presidency.ucsb.edu/ws/index.php?pid=58968"
"Amendment of Executive Order No. 10127, Establishing Airspace Reservations Over Certain Facilities of the United States Atomic Energy Commission","1958","34-Eisenhower",TRUE,"__AEC__; __engineering__",175,0.0228571428571429,"10127","12434","http://www.presidency.ucsb.edu/ws/index.php?pid=60623"
"Interagency Coordination of Arms Control and Disarmament Matters","1962","35-Kennedy",TRUE,"__State__; __DOD__; __AEC__; __CIA__; __NASA__; __science/research__; __OMB__",820,0.00609756097560976,"","12608","http://www.presidency.ucsb.edu/ws/index.php?pid=58983"
"Improving Agency Disclosure of Information","2005","43-G. W. Bush",TRUE,"__OMB__; __DOJ__; __computing__; __technology__; __budget__",2290,0.00131004366812227,"","","http://www.presidency.ucsb.edu/ws/index.php?pid=65227"
"Increasing Participation of Asian Americans and Pacific Islanders in Federal Programs","1999","42-Clinton",TRUE,"__health__; __education__; __economy__; __HHS__; __science/research__; __GSA__",1138,0.00439367311072056,"","13216; 13515","http://www.presidency.ucsb.edu/ws/index.php?pid=57692"
"Critical Infrastructure Protection in the Information Age","2001","43-G. W. Bush",TRUE,"__technology__; __energy__; __health__; __economy__; __security__; __OMB__; __DOD__; __DOJ__; __DOE__; __HHS__; __NIST__; __DOC__; __war__; __computing__; __science/research__; __OSTP__; __university__; __NSF__; __DOTr__; __State__; __DOT__; __GSA__; __FCC__; __NSC__; __budget__; __EPA__; __foreign__",4011,0.00772874594864124,"13228; 12472; 12333; 12382; 13130; 12958","13284; 13286; 13316; 13385; 13446; 13511; 13585; 13587; 13652; 13653","http://www.presidency.ucsb.edu/ws/index.php?pid=61512"
"Regulations Governing the Transportation of Household Goods of Members of the Air Force, Army, Navy, Marine Corps, Coast Guard, Coast and Geoectic Survey, and Public Health Service","1949","33-Truman",TRUE,"__health__; __war__; __computing__; __medical__; __foreign__; __education__; __economy__",13451,0.000520407404653929,"9956","","http://www.presidency.ucsb.edu/ws/index.php?pid=78245"
"Placing Certain Positions in Levels IV and V of the Executive Schedule","1974","37-Nixon",TRUE,"__health__; __education__; __NIH__; __DOTr__; __OMB__; __DOL__; __DOD__; __science/research__; __engineering__; __DOT__; __DOC__; __DOJ__; __environment__; __State__; __security__; __GSA__",407,0.00982800982800983,"11708","11774; 11780; 11831; 11843; 11861","http://www.presidency.ucsb.edu/ws/index.php?pid=106789"
"Economic Sanctions Against Iran","1980","39-Carter",TRUE,"__economy__; __security__; __foreign__; __medical__; __DOTr__",764,0.00392670157068063,"12170","12211; 12282","http://www.presidency.ucsb.edu/ws/index.php?pid=33235"
"Providing for the Administration of the Ryukyu Islands","1957","34-Eisenhower",TRUE,"__DOD__; __economy__; __State__; __foreign__; __computing__; __security__",2744,0.000364431486880466,"","11010; 11263; 11326; 11395; 11618","http://www.presidency.ucsb.edu/ws/index.php?pid=106354"
"Prescribing Rules and Regulations Relating to the Administration of the Watershed Protection and Flood Prevention Act","1954","34-Eisenhower",TRUE,"__USDA__; __DOI__; __DOD__; __engineering__; __economy__; __DOC__",1238,0.000807754442649435,"","10913","http://www.presidency.ucsb.edu/ws/index.php?pid=59240"
"Including Certain Lands in the Cherokee National Forest","1956","34-Eisenhower",TRUE,"__USDA__; __OMB__; __DOE__; __war__",13330,0.000300075018754689,"10530","","http://www.presidency.ucsb.edu/ws/index.php?pid=106389"
"Creating an Emergency Board To Investigate a Dispute Between Certain Carriers Represented by the New York Harbor Carriers' Conference Committee and Certain of Their Employees","1960","34-Eisenhower",TRUE,"__engineering__",340,0.00294117647058824,"","12553","http://www.presidency.ucsb.edu/ws/index.php?pid=106534"
"Amending the Selective Service Regulations","1970","37-Nixon",TRUE,"__medical__",201,0.0199004975124378,"10001; 10008; 10292; 11098","12553","http://www.presidency.ucsb.edu/ws/index.php?pid=105882"
"Responses to Environmental Damage","1981","39-Carter",TRUE,"__environment__; __CEQ__; __EPA__; __HHS__; __health__; __DOJ__; __DOD__; __security__; __DOT__; __DOTr__; __DOL__; __OMB__; __DOI__; __NOAA__; __foreign__; __State__",2405,0.000415800415800416,"","12316","http://www.presidency.ucsb.edu/ws/index.php?pid=44584"
"Actions To Expedite Energy-Related Projects","2001","43-G. W. Bush",TRUE,"__energy__; __environment__; __health__; __State__; __HUD__; __education__; __HHS__; __EPA__; __CIA__; __GSA__; __OMB__; __economy__; __CEQ__; __DOE__",454,0.0242290748898678,"","13286; 13302; 13337","http://www.presidency.ucsb.edu/ws/index.php?pid=61493"
"Adjustments of Certain Rates of Pay and Allowances","1987","40-Reagan",TRUE,"__foreign__; __medical__",402,0.00248756218905473,"12578","12663","http://www.presidency.ucsb.edu/ws/index.php?pid=33873"
"Delegating to the Civil Service Commission the Authority of the President To Prescribe Regulations Under the Federal Employees International Organization Service Act","1959","34-Eisenhower",TRUE,"__nuclear__; __energy__",226,0.00884955752212389,"9721; 10103; 10774","11552; 12107","http://www.presidency.ucsb.edu/ws/index.php?pid=106501"
"Presidents Council of Advisors on Science and Technology","2001","43-G. W. Bush",TRUE,"__PCAST__; __science/research__; __technology__; __NSTC__; __OSTP__; __GSA__",494,0.062753036437247,"12882; 12907; 13138","13305; 13349; 13385; 13446; 13511; 13539","http://www.presidency.ucsb.edu/ws/index.php?pid=61507"
"Improving the Means for Obtaining Compliance with the Nondiscrimination Provisions of Federal Contracts","1951","33-Truman",TRUE,"__DOD__; __DOL__; __AEC__; __GSA__",577,0.00173310225303293,"","10461; 10479","http://www.presidency.ucsb.edu/ws/index.php?pid=78360"
"United States Intelligence Activities","1981","40-Reagan",TRUE,"__foreign__; __security__; __NSC__; __economy__; __budget__; __DOC__; __DOJ__; __DOD__; __State__; __OMB__; __CIA__; __war__; __science/research__; __DOTr__; __DOE__; __energy__; __innovation__; __HHS__",6346,0.00220611408761425,"12036","12472; 12564; 12829; 13231; 13283; 13284; 13286; 13354; 13355; 13356; 13381; 13462; 13467; 13470; 13516; 13526; 13549; 13587; 13618; 13691","http://www.presidency.ucsb.edu/ws/index.php?pid=43324"
"Creating a Board of Inquiry to Report on a Labor Dispute Affecting the Maritime Industry of the United States","1961","35-Kennedy",TRUE,"__foreign__; __engineering__; __health__",261,0.00383141762452107,"","10951; 12553","http://www.presidency.ucsb.edu/ws/index.php?pid=58887"
"Suspension of the Eight-Hour Law as to Laborers and Mechanics Employed by the National Aeronautics and Space Administration","1961","35-Kennedy",TRUE,"__NASA__",348,0.0114942528735632,"","12553","http://www.presidency.ucsb.edu/ws/index.php?pid=58914"
"Amending Executive Order No. 11157 as it Relates to Incentive Pay for Hazardous Duty","1965","36-Johnson",TRUE,"__DOD__; __computing__",298,0.00335570469798658,"11157","","http://www.presidency.ucsb.edu/ws/index.php?pid=105671"
"Establishing an Airspace Reservation Over the Savannah River Plant of the United States Atomic Energy Commission","1951","33-Truman",TRUE,"__AEC__",248,0.00806451612903226,"","","http://www.presidency.ucsb.edu/ws/index.php?pid=78427"
"Blocking Property of Persons in Connection With the Conflict in Sudan's Darfur Region","2006","43-G. W. Bush",TRUE,"__economy__; __security__; __foreign__; __DOTr__; __State__; __technology__; __war__",1496,0.000668449197860963,"13067","","http://www.presidency.ucsb.edu/ws/index.php?pid=72507"
"Placing Certain Positions in Levels IV and V of the Federal Executive Salary Schedule","1964","36-Johnson",TRUE,"__science/research__; __State__; __AEC__; __DOC__; __DOD__; __security__; __DOI__; __DOL__",254,0.0118110236220472,"","11195; 12060","http://www.presidency.ucsb.edu/ws/index.php?pid=106280"
"Office of Consumer Affairs","1971","37-Nixon",TRUE,"__economy__; __health__; __science/research__; __education__",1593,0.000627746390458255,"11566; 11136; 11349","11595; 11702; 11827; 11948; 12007; 12608","http://www.presidency.ucsb.edu/ws/index.php?pid=59092"
"Further Providing for the Administration of the Defense Mobilization Program","1953","34-Eisenhower",TRUE,"__State__; __foreign__; __DOI__; __USDA__; __DOC__; __DOD__; __AEC__; __GSA__; __science/research__; __technology__; __DOL__; __nuclear__; __energy__; __war__; __economy__",4219,0.00165916093861105,"10224; 10281; 10161; 10169; 10193; 10200; 10223; 10324; 10359; 10373; 10377; 10390; 10433; 10467; 10461; 10182; 10206; 10219","10489; 10493; 10537; 10574; 10662; 10773; 10819; 11051; 11062; 11362; 11572; 11594; 11725; 11748; 11790; 11879; 11956; 12038; 12148; 12521; 12649; 12773; 12919","http://www.presidency.ucsb.edu/ws/index.php?pid=59221"
"Interagency Working Group on Coordination of Domestic Energy Development and Permitting in Alaska","2011","44-Obama",TRUE,"__energy__; __foreign__; __health__; __environment__; __DOI__; __DOD__; __DOC__; __USDA__; __DOE__; __DHS__; __EPA__; __security__; __CEQ__; __OSTP__; __OMB__; __science/research__; __budget__",897,0.0133779264214047,"13547","13604; 13653","http://www.presidency.ucsb.edu/ws/index.php?pid=90622"
"Establishing the President's Committee on Juvenile Delinquency and Youth Crime","1961","35-Kennedy",TRUE,"__science/research__; __DOJ__; __DOL__; __health__; __education__; __innovation__",767,0.00260756192959583,"","11529","http://www.presidency.ucsb.edu/ws/index.php?pid=58878"
"Regulations Relating to Commissioned Officers and Employees of the Public Health Service","1945","33-Truman",TRUE,"__health__; __security__; __medical__; __science/research__; __foreign__; __war__; __engineering__; __education__; __university__; __math__; __OMB__",15894,0.00314584119793633,"9575","9897; 9993","http://www.presidency.ucsb.edu/ws/index.php?pid=77867"
"Providing an Order of Succession Within the Department of Agriculture","2012","44-Obama",TRUE,"__USDA__; __foreign__; __science/research__; __education__; __economy__; __environment__",574,0.00174216027874564,"13542","","http://www.presidency.ucsb.edu/ws/index.php?pid=100900"
"Assigning Certain Emergency Preparedness Functions to the Housing and Home Finance Administrator","1962","35-Kennedy",TRUE,"__DOC__; __economy__; __DOD__; __health__; __education__; __science/research__",1134,0.00352733686067019,"10952","11490","http://www.presidency.ucsb.edu/ws/index.php?pid=58943"
"Carrying out Provisions of the Beirut Agreement of 1948 Relating to Audio-Visual Materials","1966","36-Johnson",TRUE,"__war__; __education__; __science/research__",203,0.00492610837438424,"","","http://www.presidency.ucsb.edu/ws/index.php?pid=59164"
"Presidents New Freedom Commission on Mental Health","2002","43-G. W. Bush",TRUE,"__health__; __HHS__; __DOL__; __education__; __innovation__; __technology__; __science/research__; __GSA__",904,0.00442477876106195,"","13316","http://www.presidency.ucsb.edu/ws/index.php?pid=61359"
"Regulations Relating to Commissioned Officers and Employees of the Public Health Service","1948","33-Truman",TRUE,"__health__; __medical__; __education__; __war__; __foreign__; __security__; __engineering__; __science/research__; __university__; __computing__",20518,0.00214445852422263,"9655; 9897; 9955","10031; 10280; 10354; 10497; 10506; 11140","http://www.presidency.ucsb.edu/ws/index.php?pid=78215"
"Federal Support of Community Efforts Along American Heritage Rivers","1997","42-Clinton",TRUE,"__environment__; __economy__; __CEQ__; __DOD__; __DOJ__; __DOI__; __USDA__; __DOC__; __HUD__; __DOT__; __DOE__; __EPA__; __art__; __health__; __science/research__",1702,0.00117508813160987,"12630","13093","http://www.presidency.ucsb.edu/ws/index.php?pid=54603"
"Continuance of Certain Federal Advisory Committees","2009","44-Obama",TRUE,"__DOI__; __DHS__; __health__; __DOL__; __university__; __DOEd__; __HHS__; __art__; __science/research__; __NSF__; __PCAST__; __OSTP__; __DOC__; __security__; __environment__; __GSA__",416,0.0192307692307692,"11145; 13231; 12196; 13256; 13270; 11183; 12994; 12367; 12216; 11287; 13265; 13226; 12131; 12382; 12905; 13446","13585","http://www.presidency.ucsb.edu/ws/index.php?pid=86712"
"President's Blue Ribbon Task Group on Nuclear Weapons Program Management","1985","40-Reagan",TRUE,"__nuclear__; __DOD__; __education__; __DOE__; __science/research__; __GSA__",536,0.0130597014925373,"","12534","http://www.presidency.ucsb.edu/ws/index.php?pid=38644"
"Israel-United States Binational Industrial Research and Development Foundation","1995","42-Clinton",TRUE,"__science/research__",152,0.0197368421052632,"","","http://www.presidency.ucsb.edu/ws/index.php?pid=51096"
"Administration of Scientific Research by Agencies of the Federal Government","1954","34-Eisenhower",TRUE,"__science/research__; __security__; __education__; __economy__; __NSF__; __health__; __budget__",914,0.0645514223194748,"","10807","http://www.presidency.ucsb.edu/ws/index.php?pid=59228"
"Amending the Selective Service Regulations and Executive Order No. 10363 of June 17, 1952","1952","33-Truman",TRUE,"__war__; __health__; __medical__",2708,0.00369276218611521,"10363; 9988; 10001; 10008; 10167; 10202; 10258; 10292; 10328","10469; 10505; 10659; 10735; 11098; 11586; 12553","http://www.presidency.ucsb.edu/ws/index.php?pid=78443"
"Designating the Department of Justice as a Defense Agency for Certain Purposes","1953","34-Eisenhower",TRUE,"__DOJ__; __security__; __AEC__; __DOD__",240,0.00416666666666667,"","","http://www.presidency.ucsb.edu/ws/index.php?pid=59217"
"Creating an Emergency Board to Investigate the Dispute Between the Barre & Chelsea Railroad Company and the St. Johnsbury & Lake Champlain Railroad Company and Certain of Their Employees","1946","33-Truman",TRUE,"__engineering__",269,0.00371747211895911,"","12553","http://www.presidency.ucsb.edu/ws/index.php?pid=77971"
"Amending the Selective Service Regulations","1962","35-Kennedy",TRUE,"__war__; __health__; __university__; __education__; __medical__; __science/research__; __engineering__",6522,0.00490647040785035,"9988; 10001; 10008; 10116; 10202; 10292; 10328; 10363; 10562; 10594; 10650; 10659; 10714; 10735; 10809","11098; 11119; 11188; 11241; 11350; 11360; 11497; 11527; 11537; 11563; 11586; 12553","http://www.presidency.ucsb.edu/ws/index.php?pid=58922"
"Amending the Selective Service Regulations","1954","34-Eisenhower",TRUE,"__university__; __medical__",613,0.0130505709624796,"10292","10984; 11360; 12553","http://www.presidency.ucsb.edu/ws/index.php?pid=106460"
"Prohibiting Certain Transactions With and Suspending Entry Into the United States of Foreign Sanctions Evaders With Respect to Iran and Syria","2012","44-Obama",TRUE,"__foreign__; __economy__; __DOTr__; __State__; __technology__; __security__",1507,0.0013271400132714,"12957; 13338; 12938; 13224; 13382","","http://www.presidency.ucsb.edu/ws/index.php?pid=100725"
"Assigning Emergency Preparedness Functions to: The Board of Directors of the Tennessee Valley Authority; The Railroad Retirement Board; The Administrator of the National Aeronautics and Space Administration; The Federal Power Commission; The Director of the National Science Foundation","1963","35-Kennedy",TRUE,"__NASA__; __NSF__; __DOI__; __DOD__; __health__; __education__; __USDA__; __DOC__; __science/research__; __economy__; __DOL__; __technology__; __medical__; __OSTP__; __engineering__; __war__; __math__",1850,0.02,"10952","11490","http://www.presidency.ucsb.edu/ws/index.php?pid=59034"
"Agency Procurement Protests","1995","42-Clinton",TRUE,"__economy__; __GSA__; __DOD__; __NASA__",468,0.00213675213675214,"","","http://www.presidency.ucsb.edu/ws/index.php?pid=50702"
"Prescribing Certain Regulations and Delegating to the Attorney General Certain Authority of the President to Prescribe Other Regulations Relating to the Recovery From Tortiously Liable Third Persons of the Cost of Hospital and Medical Care and Treatment Furnished by the United States","1962","35-Kennedy",TRUE,"__DOJ__; __medical__; __OMB__",131,0.0229007633587786,"","12608","http://www.presidency.ucsb.edu/ws/index.php?pid=58999"
"Amending the Selective Service Regulations","1951","33-Truman",TRUE,"__foreign__; __State__; __university__; __DOJ__; __education__",1334,0.00149925037481259,"9979; 9988; 9992; 10008","10292; 10837; 12553","http://www.presidency.ucsb.edu/ws/index.php?pid=78382"
"Providing for Certain Arrangements Under the Columbia River Treaty","1964","36-Johnson",TRUE,"__engineering__; __DOI__; __DOD__",647,0.0154559505409583,"","12038","http://www.presidency.ucsb.edu/ws/index.php?pid=59141"
"Creating an Emergency Board To Investigate a Dispute Between Certain Carriers Represented by the Eastern, Western, and Southeastern Carriers' Conference Committees and Certain of Their Employees","1955","34-Eisenhower",TRUE,"__university__",1071,0.00186741363211951,"","12553","http://www.presidency.ucsb.edu/ws/index.php?pid=106431"
"Amending the Selective Service Regulations","1970","37-Nixon",TRUE,"__health__; __NSC__; __university__",1034,0.00193423597678917,"10001; 10202; 10292; 10659; 10735; 10984; 11098; 11119; 11241; 11360; 11497","12553","http://www.presidency.ucsb.edu/ws/index.php?pid=60484"
"Creating an Emergency Board to Investigate Disputes Between the Carriers Represented by the National Railway Labor Conference and Certain of Their Employees","1969","36-Johnson",TRUE,"__engineering__; __war__",888,0.00900900900900901,"","12553","http://www.presidency.ucsb.edu/ws/index.php?pid=105972"
"Amending the Selective Service Regulations","1970","37-Nixon",TRUE,"__medical__",1581,0.000632511068943707,"10001; 10202; 10292; 10659; 10735; 10984; 11098; 11119; 11241; 11360; 11497; 11537","12553","http://www.presidency.ucsb.edu/ws/index.php?pid=105891"
"Assignment of National Security and Emergency Preparedness Communications Functions","2012","44-Obama",TRUE,"__security__; __NSC__; __OSTP__; __science/research__; __State__; __GSA__; __FCC__; __DHS__; __DOD__; __OMB__; __nuclear__; __DOC__; __budget__",2255,0.00310421286031042,"12333; 13526; 12472; 12382","","http://www.presidency.ucsb.edu/ws/index.php?pid=101334"
"Amending the Civil Service Rules to Authorize an Executive Assignment System for Positions in Grades 16, 17, and 18 of the General Schedule","1966","36-Johnson",TRUE,"__war__; __science/research__; __education__",2103,0.000475511174512601,"","12107; 12748","http://www.presidency.ucsb.edu/ws/index.php?pid=59165"
"Establishing a White House Council on Strong Cities, Strong Communities","2012","44-Obama",TRUE,"__economy__; __HUD__; __DOTr__; __DOD__; __DOJ__; __DOI__; __USDA__; __DOC__; __DOL__; __HHS__; __DOT__; __DOE__; __DOEd__; __VA__; __DHS__; __EPA__; __OMB__; __GSA__; __art__; __CEQ__; __OSTP__; __budget__",1250,0.0016,"","","http://www.presidency.ucsb.edu/ws/index.php?pid=100048"
"Improving Performance of Federal Permitting and Review of Infrastructure Projects","2012","44-Obama",TRUE,"__environment__; __economy__; __energy__; __health__; __security__; __technology__; __CEQ__; __DOD__; __DOI__; __USDA__; __DOC__; __DOT__; __DOE__; __DHS__; __EPA__; __OMB__; __budget__",1709,0.00526623756582797,"13580; 13563; 13175","13616; 13653","http://www.presidency.ucsb.edu/ws/index.php?pid=100316"
"Providing for Establishing User Fees Pursuant to the Land and Water Conservation Fund Act of 1965","1965","36-Johnson",TRUE,"__engineering__; __DOI__; __USDA__; __DOD__; __science/research__; __economy__",1810,0.00165745856353591,"11017","","http://www.presidency.ucsb.edu/ws/index.php?pid=59145"
"Blocking Property of the Government of the Russian Federation Relating to the Disposition of Highly Enriched Uranium Extracted From Nuclear Weapons","2000","42-Clinton",TRUE,"__nuclear__; __economy__; __security__; __foreign__; __DOTr__; __State__; __DOE__",871,0.00803673938002296,"12938; 13085","13313; 13617","http://www.presidency.ucsb.edu/ws/index.php?pid=61651"
