"title","year","president","st.flag","matchWords","word.count","stMatchRatio","eoMatches.out","eoMatches.in","link"
"Designation of Officers of the Department of the Interior to act as Secretary of the Interior","1969","37-Nixon",FALSE,"__DOI__",208,0,"10753","13244","http://www.presidency.ucsb.edu/ws/index.php?pid=59074"
"Amending Executive Order No. 10873 to Provide for an Exception to the Inter-American Development Bank's Immunity From Suit Specified in the International Organizations Immunities Act","1962","35-Kennedy",FALSE,"",127,0,"10873","","http://www.presidency.ucsb.edu/ws/index.php?pid=58958"
"Authorizing the Secretary of the Navy To Take Possession of and Operate the Plants and Facilities of Goodyear Tire & Rubber Company Inc., Located at Akron, Ohio","1945","33-Truman",FALSE,"__DOD__; __war__; __DOJ__; __DOL__",800,0,"","9603","http://www.presidency.ucsb.edu/ws/index.php?pid=106494"
"Modifying the Protection Granted to the Development Fund for Iraq and Certain Property in Which Iraq Has an Interest and Protecting the Central Bank of Iraq","2004","43-G. W. Bush",FALSE,"__economy__; __security__; __foreign__; __DOTr__; __State__",769,0,"13303; 13315; 13350","13438; 13668","http://www.presidency.ucsb.edu/ws/index.php?pid=61457"
"Establishing a Seal for the Department of Health, Education, and Welfare","1953","34-Eisenhower",FALSE,"__health__; __education__",203,0,"","","http://www.presidency.ucsb.edu/ws/index.php?pid=106560"
"Creating an Emergency Board to Investigate Disputes Between the Grand Trunk Western Railroad Company, Pere Marquette Railway Company, Wabash Railroad Company, Ann Arbor Railroad Company, and Certain of Their Employees","1947","33-Truman",FALSE,"",270,0,"","12553","http://www.presidency.ucsb.edu/ws/index.php?pid=60713"
"General Creighton W. Abrams, Chief of Staff, United States Army","1974","38-Ford",FALSE,"",145,0,"","","http://www.presidency.ucsb.edu/ws/index.php?pid=23894"
"United States Foreign Intelligence Activities","1977","39-Carter",FALSE,"__foreign__; __security__",241,0,"11905; 11985","12036","http://www.presidency.ucsb.edu/ws/index.php?pid=7615"
"Creating an Emergency Board to Investigate a Dispute Between the Carriers Represented by the National Railway Labor Conference and Certain of Their Employees","1975","38-Ford",FALSE,"",308,0,"","12553","http://www.presidency.ucsb.edu/ws/index.php?pid=60463"
"Strategic and Critical Materials","1979","39-Carter",FALSE,"__GSA__; __DOI__; __USDA__",401,0,"12148","12417","http://www.presidency.ucsb.edu/ws/index.php?pid=31310"
"Creating an Emergency Board to Investigate Disputes Between the REA Express and Certain of its Employees","1962","35-Kennedy",FALSE,"__war__",227,0,"","12553; 12856; 12898; 13148","http://www.presidency.ucsb.edu/ws/index.php?pid=58989"
"Designating the Fish and Wildlife Service as the Agency Responsible for the Enforcement of the Sockeye Salmon Fishery Act of 1947","1947","33-Truman",FALSE,"__DOI__",147,0,"","","http://www.presidency.ucsb.edu/ws/index.php?pid=59311"
"Amendment of Executive Order No. 5952 of November 23, 1932, as Amended, Prescribing the Army Ration","1962","35-Kennedy",FALSE,"__war__",159,0,"9561","11339","http://www.presidency.ucsb.edu/ws/index.php?pid=58971"
"Amendment of Executive Order No. 4601 of March 1, 1927, Prescribing Regulations Pertaining to the Award of the Distinguished Flying Cross","1950","33-Truman",FALSE,"__war__",447,0,"9615","","http://www.presidency.ucsb.edu/ws/index.php?pid=60781"
"Internal Revenue Service Management Board","1997","42-Clinton",FALSE,"__DOTr__; __security__; __OMB__; __budget__",698,0,"","","http://www.presidency.ucsb.edu/ws/index.php?pid=54317"
"Modifying the Exterior Boundaries of Certain National Forests in Alabama, Florida, Louisiana, Mississippi, North Carolina, Oklahoma, and South Carolina","1959","34-Eisenhower",FALSE,"__USDA__; __war__",4534,0,"","","http://www.presidency.ucsb.edu/ws/index.php?pid=106532"
"Amending Executive Order No. 11022, Relating to the President's Council on Aging","1967","36-Johnson",FALSE,"__health__; __education__; __USDA__; __DOC__; __HUD__; __DOL__; __DOT__; __DOTr__; __economy__",145,0,"11022","","http://www.presidency.ucsb.edu/ws/index.php?pid=106108"
"Delegation of Functions Under the Freedom Support Act and Related Provisions of the Foreign Operations","1993","42-Clinton",FALSE,"__foreign__; __State__; __USDA__",632,0,"12163","13030; 13118","http://www.presidency.ucsb.edu/ws/index.php?pid=61577"
"Inspection of Income, Estate, and Gift Tax Returns by the Committee on Public Works, House of Representatives","1969","37-Nixon",FALSE,"__DOTr__",183,0,"","","http://www.presidency.ucsb.edu/ws/index.php?pid=105980"
"Designation of Certain Officers of the Department of Commerce to Act as Secretary of Commerce","1950","33-Truman",FALSE,"__DOC__",215,0,"9885","11388","http://www.presidency.ucsb.edu/ws/index.php?pid=78324"
"Inspection of Income, Estate, and Gift Tax Returns by the Committee on Banking and Currency, House of Representatives","1965","36-Johnson",FALSE,"__DOTr__",182,0,"","","http://www.presidency.ucsb.edu/ws/index.php?pid=106234"
"Reports on International Organizations","1982","40-Reagan",FALSE,"__foreign__; __State__; __OMB__",159,0,"","12408","http://www.presidency.ucsb.edu/ws/index.php?pid=42795"
"President's Private Sector Survey on Cost Control in the Federal Government","1982","40-Reagan",FALSE,"__DOC__; __GSA__",607,0,"","12398; 12429; 12447; 12455; 12534","http://www.presidency.ucsb.edu/ws/index.php?pid=42692"
"Further Amendment to Executive Order 13038 - Advisory Committee on Public Interest Obligations of Digital Television Broadcasters","1997","42-Clinton",FALSE,"",129,0,"13038; 13062","13138","http://www.presidency.ucsb.edu/ws/index.php?pid=53443"
"Restricting Competition in Certain Civil-service Examinations to Veterans","1945","33-Truman",FALSE,"__DOJ__; __war__",117,0,"","9738","http://www.presidency.ucsb.edu/ws/index.php?pid=77872"
"Interagency Committee on Handicapped Employees","1989","41-H.W. Bush",FALSE,"",118,0,"11830","","http://www.presidency.ucsb.edu/ws/index.php?pid=60448"
"Administration of Foreign Aid and Foreign Information Functions","1953","34-Eisenhower",FALSE,"__foreign__; __security__; __economy__; __DOD__; __State__; __war__; __OMB__",2445,0,"10159; 10300; 10380; 10458; 10338; 10062","10560; 10575","http://www.presidency.ucsb.edu/ws/index.php?pid=106608"
"Small Business Conference Commission","1978","39-Carter",FALSE,"",215,0,"12061","","http://www.presidency.ucsb.edu/ws/index.php?pid=30088"
"Implementation of Section 311(a) of the Comprehensive Anti-Apartheid Act","1991","41-H.W. Bush",FALSE,"",354,0,"12571; 12532; 12535","","http://www.presidency.ucsb.edu/ws/index.php?pid=19768"
"White House Fellowships","1976","38-Ford",FALSE,"",266,0,"11183","","http://www.presidency.ucsb.edu/ws/index.php?pid=23672"
"Further Exemption of John Monroe Johnson From Compulsory Retirement for Age","1949","33-Truman",FALSE,"",171,0,"9954","","http://www.presidency.ucsb.edu/ws/index.php?pid=78280"
"Creating an Emergency Board to Investigate Disputes Between the Carriers Represented by the National Railway Labor Conference and Certain of Their Employees","1967","36-Johnson",FALSE,"",1076,0,"","12553","http://www.presidency.ucsb.edu/ws/index.php?pid=60546"
"Reports on International Organizations","1983","40-Reagan",FALSE,"__State__",130,0,"12374","12553","http://www.presidency.ucsb.edu/ws/index.php?pid=40966"
"Establishing the President's Advisory Council on the Arts","1963","35-Kennedy",FALSE,"__art__; __State__; __DOTr__; __DOD__; __DOI__; __DOL__; __health__; __education__; __GSA__",749,0,"","11124; 11208","http://www.presidency.ucsb.edu/ws/index.php?pid=59051"
"Providing for the Restoration of Law and Order in the Virgin Islands","1989","41-H.W. Bush",FALSE,"__DOD__; __DOJ__",315,0,"","","http://www.presidency.ucsb.edu/ws/index.php?pid=60452"
"Amendment of Executive Order 10560, Providing for the Administration of the Agricultural Trade Development and Assistance Act of 1954, as Amended","1960","34-Eisenhower",FALSE,"__USDA__",232,0,"10560","10900; 12220","http://www.presidency.ucsb.edu/ws/index.php?pid=106549"
"Designating the Airport Being Constructed in the Counties of Fairfax and Loudoun in the State of Virginia as the Dulles International Airport","1959","34-Eisenhower",FALSE,"",204,0,"","","http://www.presidency.ucsb.edu/ws/index.php?pid=59274"
"Designating Certain Officers of the Government to Which the Annual and Sick Leave Act of 1951, as Amended Shall Not Apply, and Delegating the Authority To Make Such Designations to the Chairman of the United States Civil Service Commission","1954","34-Eisenhower",FALSE,"__OMB__; __State__; __security__; __DOTr__; __DOD__; __DOI__; __DOL__; __DOC__; __CIA__; __GSA__; __war__",703,0,"","12107","http://www.presidency.ucsb.edu/ws/index.php?pid=60587"
"Placing an Additional Position in Level V of the Federal Executive Salary Schedule","1967","36-Johnson",FALSE,"__DOT__",84,0,"11248","","http://www.presidency.ucsb.edu/ws/index.php?pid=106080"
"Possession, Control, and Operation of the Transportation System, Plants, and Facilities of the Great Lakes Towing Company, Cleveland, Ohio","1945","33-Truman",FALSE,"__war__; __DOD__",728,0,"","","http://www.presidency.ucsb.edu/ws/index.php?pid=60683"
"Further Amendment to Executive Order 12866 on Regulatory Planning and Review","2007","43-G. W. Bush",FALSE,"__war__; __economy__; __environment__; __health__; __budget__; __foreign__; __OMB__; __DOJ__",1059,0,"12866","13497","http://www.presidency.ucsb.edu/ws/index.php?pid=24456"
"Incentive Pay for Hazardous Duty","1982","40-Reagan",FALSE,"__health__",663,0,"11157","","http://www.presidency.ucsb.edu/ws/index.php?pid=42016"
"Amending Executive Order No. 8684 to Redefine the Culebra Island Naval Defensive Sea Area","1972","37-Nixon",FALSE,"",261,0,"","","http://www.presidency.ucsb.edu/ws/index.php?pid=60505"
"Adding the Small Business Administration to the President's Export Council","1996","42-Clinton",FALSE,"",99,0,"12131","","http://www.presidency.ucsb.edu/ws/index.php?pid=52501"
"Amending Executive Order No. 11246, Relating to  Equal Employment Opportunity","1967","36-Johnson",FALSE,"__DOL__",784,0,"11246","11478","http://www.presidency.ucsb.edu/ws/index.php?pid=60553"
"Providing for the Restoration of Certain Lands to Kaakaukukui, Honolulu, Hawaii, to the Jurisdiction of the Territory of Hawaii and Transfer of Title Thereto to the Territory","1955","34-Eisenhower",FALSE,"__DOD__; __GSA__",909,0,"10309","","http://www.presidency.ucsb.edu/ws/index.php?pid=106400"
"Amending Subdivision Vii of Schedule a of the Civil Service Rules","1945","33-Truman",FALSE,"",69,0,"","9830","http://www.presidency.ucsb.edu/ws/index.php?pid=77938"
"Suspension of the Eight-Hour Law as to Laborers and Mechanics Employed by the Departments of the Army and the Air Force on Certain Public Works","1947","33-Truman",FALSE,"__DOD__",473,0,"","10064; 10135; 10251; 9926; 9974","http://www.presidency.ucsb.edu/ws/index.php?pid=78143"
"Establishing the Council for Rural Affairs","1969","37-Nixon",FALSE,"__economy__; __USDA__; __DOI__; __DOC__; __health__; __education__; __HUD__; __DOL__; __OMB__",583,0,"","11541; 12553","http://www.presidency.ucsb.edu/ws/index.php?pid=60480"
"Further Amendment to Executive Order No. 11755","1994","42-Clinton",FALSE,"__DOJ__",204,0,"11755","","http://www.presidency.ucsb.edu/ws/index.php?pid=49588"
"Export Administration Act of 1969","1977","39-Carter",FALSE,"__foreign__; __State__; __DOC__; __DOD__; __security__; __economy__",772,0,"11533; 11846; 11683; 11798; 11818; 11907; 11940","12214; 12444; 12451; 12470; 12525; 12730; 12755; 12867; 12923; 12924; 12981; 13206; 13222; 13286","http://www.presidency.ucsb.edu/ws/index.php?pid=7765"
"Placing an Additional Position in Level V of the Federal Executive Salary Schedule","1968","36-Johnson",FALSE,"__economy__; __DOC__",87,0,"11248","","http://www.presidency.ucsb.edu/ws/index.php?pid=106175"
"Calling Into Service Members and Units of the National Guard","1970","37-Nixon",FALSE,"__DOD__",489,0,"","","http://www.presidency.ucsb.edu/ws/index.php?pid=105858"
"Restoring Certain Lands to the Jurisdiction of the Territory of Hawaii","1948","33-Truman",FALSE,"",311,0,"","","http://www.presidency.ucsb.edu/ws/index.php?pid=78205"
"Administration of the Housing and Rent Act of 1947, as Amended","1953","34-Eisenhower",FALSE,"__economy__; __DOD__",425,0,"10276; 10293; 10456","10773","http://www.presidency.ucsb.edu/ws/index.php?pid=106585"
"Inspection of Income, Excess-Profits, Estate, and Gift Tax Returns by the Committee on Un-American Activities, House of Representatives","1963","35-Kennedy",FALSE,"__DOTr__",198,0,"","","http://www.presidency.ucsb.edu/ws/index.php?pid=59048"
"Making Certain Time Limitations Imposed By Executive Order No. 4601 of March 1, 1927, Prescribing Regulations Pertaining to the Award of the Distinguished Flying Cross, Inapplicable to Certain Cases","1945","33-Truman",FALSE,"__war__",161,0,"","10189","http://www.presidency.ucsb.edu/ws/index.php?pid=77935"
"Creating an Emergency Board to Investigate Dispute Between the Toledo, Lorain & Fairport Dock Company and Certain of Its Employees","1950","33-Truman",FALSE,"",239,0,"","12553","http://www.presidency.ucsb.edu/ws/index.php?pid=78314"
"Designating Officials to Act as Commissioner of the District of Columbia","1967","36-Johnson",FALSE,"",133,0,"","","http://www.presidency.ucsb.edu/ws/index.php?pid=106109"
"National Security Medal","1953","33-Truman",FALSE,"__security__; __NSC__; __DOD__",572,0,"","","http://www.presidency.ucsb.edu/ws/index.php?pid=58849"
"Providing for the Establishment of a National Defense Executive Reserve","1956","34-Eisenhower",FALSE,"__economy__",385,0,"","10773; 11051; 11179","http://www.presidency.ucsb.edu/ws/index.php?pid=106365"
"Authorizing Award of the Bronze Star Medal","1962","35-Kennedy",FALSE,"__DOTr__; __foreign__; __DOD__",410,0,"","11382; 13286","http://www.presidency.ucsb.edu/ws/index.php?pid=58985"
"Creating an Emergency Board To Investigate a Dispute Between the Capital Airlines, Inc., National Airlines, Inc., Northwest Airlines, Inc., Trans World Airlines, Inc., United Airlines, Inc., Eastern Airlines, Inc., and Certain of Their Employees","1954","34-Eisenhower",FALSE,"",248,0,"","12553","http://www.presidency.ucsb.edu/ws/index.php?pid=106469"
"Regulations Relating to the Safeguarding of Vessels, Harbors, Ports, and Waterfront Facilities of the United States","1950","33-Truman",FALSE,"__security__; __DOL__",1933,0,"","10277; 10352; 11249; 13143; 13273","http://www.presidency.ucsb.edu/ws/index.php?pid=60775"
"Inspection of Income, Excess-Profits, Estate, and Gift Tax returns by the House Committee on Public Works","1960","34-Eisenhower",FALSE,"__DOTr__",193,0,"","","http://www.presidency.ucsb.edu/ws/index.php?pid=106542"
"United States International Development Cooperation Agency","1979","39-Carter",FALSE,"",106,0,"","","http://www.presidency.ucsb.edu/ws/index.php?pid=32618"
"Amending the Selective Service Regulations","1963","35-Kennedy",FALSE,"",237,0,"10735; 10984; 11098","11241; 11497; 11527; 11537; 11563; 12553","http://www.presidency.ucsb.edu/ws/index.php?pid=59058"
"Creating an Emergency Board to Investigate a Dispute Between the Railway Express Agency, Inc., and Certain of Its Employees","1950","33-Truman",FALSE,"__war__",248,0,"","12553","http://www.presidency.ucsb.edu/ws/index.php?pid=78336"
"Amendment Relating to Basic Allowance for Quarters","1991","41-H.W. Bush",FALSE,"",96,0,"11157","","http://www.presidency.ucsb.edu/ws/index.php?pid=23601"
"Revocation of Certain Executive Orders Concerning Federal Contracting","1993","42-Clinton",FALSE,"",149,0,"12818; 12800","13201; 13202","http://www.presidency.ucsb.edu/ws/index.php?pid=61532"
"Suspending Certain Statutory Provisions Relating to Employment in the Canal Zone","1948","33-Truman",FALSE,"__DOD__",169,0,"","10040","http://www.presidency.ucsb.edu/ws/index.php?pid=78219"
"President's Special Review Board","1987","40-Reagan",FALSE,"",103,0,"12575","","http://www.presidency.ucsb.edu/ws/index.php?pid=34497"
"Providing Assistance for the Removal of Unlawful Obstructions of Justice in the State of Mississippi","1962","35-Kennedy",FALSE,"__DOD__",599,0,"","","http://www.presidency.ucsb.edu/ws/index.php?pid=58992"
"Inspection of Returns by Senate Committee on the Judiciary","1952","33-Truman",FALSE,"",179,0,"","","http://www.presidency.ucsb.edu/ws/index.php?pid=78512"
"Designating Certain Public International Organizations Entitled to Enjoy Certain Privileges, Exemptions, and Immunities","1977","38-Ford",FALSE,"",330,0,"11718","","http://www.presidency.ucsb.edu/ws/index.php?pid=23770"
"Assigning Foreign Affairs Functions and Implementing the Enterprise for the Americas Initiative and the Tropical Forest Conservation Act","2004","43-G. W. Bush",FALSE,"__foreign__; __DOTr__; __State__; __USDA__; __OMB__; __EPA__; __CEQ__; __economy__; __DOC__; __DOI__; __DOJ__; __security__",1211,0,"11269; 12757; 12823; 13028; 13131","","http://www.presidency.ucsb.edu/ws/index.php?pid=61439"
"Creating an Emergency Board to Investigate Disputes Between the Carriers Represented by the National Railway Labor Conference and Certain of Their Employees","1964","36-Johnson",FALSE,"",1006,0,"","12553","http://www.presidency.ucsb.edu/ws/index.php?pid=106248"
"Relating to Aerial Flights By Personnel of the Coast and Geodetic Survey","1945","33-Truman",FALSE,"__health__",199,0,"","","http://www.presidency.ucsb.edu/ws/index.php?pid=77876"
"Terminating the President's Advisory Committee on Supersonic Transport","1968","36-Johnson",FALSE,"",90,0,"11149; 11382","","http://www.presidency.ucsb.edu/ws/index.php?pid=106197"
"Payment of Certain Benefits to Survivors of Persons Who Died in or as a Result of Military Service","1983","40-Reagan",FALSE,"__HHS__; __DOD__",315,0,"","","http://www.presidency.ucsb.edu/ws/index.php?pid=41660"
"Establishment of Pakistan and Afghanistan Support Office","2010","44-Obama",FALSE,"__State__; __security__; __economy__; __OMB__; __budget__",469,0,"","","http://www.presidency.ucsb.edu/ws/index.php?pid=88354"
"Establishing the National Advisory Board on Mobilization Policy","1951","33-Truman",FALSE,"",376,0,"","10461; 10480; 10773","http://www.presidency.ucsb.edu/ws/index.php?pid=78376"
"Transferring Jurisdiction Over Certain Lands From the Department of Agriculture to the Department of the Interior, for Use, Administration, or Exchange Under the Taylor Grazing Act and Other Statutes","1958","34-Eisenhower",FALSE,"__USDA__; __DOI__",797,0,"","","http://www.presidency.ucsb.edu/ws/index.php?pid=106320"
"Inspection of Income, Estate, and Gift Tax Returns by the Committee on Public Works, House of Representatives","1967","36-Johnson",FALSE,"__DOTr__",187,0,"","","http://www.presidency.ucsb.edu/ws/index.php?pid=106103"
"Excusing Federal Employees Rom Duty One-Half Day on December 24, 1947","1947","33-Truman",FALSE,"",170,0,"","","http://www.presidency.ucsb.edu/ws/index.php?pid=78152"
"Assignment of Certain Pay-Related Functions","2006","43-G. W. Bush",FALSE,"",202,0,"12748; 12828","","http://www.presidency.ucsb.edu/ws/index.php?pid=24331"
"Adjustments of Certain Rates of Pay","2000","42-Clinton",FALSE,"__foreign__; __health__; __VA__",442,0,"10639; 13144","13249","http://www.presidency.ucsb.edu/ws/index.php?pid=61673"
"Amending Executive Order No. 9386 of October 15, 1943, Prescribing Regulations Governming the Granting of Allowances for Quarters and Subsistence to Enlisted Men","1947","33-Truman",FALSE,"",367,0,"","9871","http://www.presidency.ucsb.edu/ws/index.php?pid=78141"
"Providing for an Additional Member and for an Executive Vice Chairman of the Government Contract Committee","1957","34-Eisenhower",FALSE,"",149,0,"10479; 10482","10925","http://www.presidency.ucsb.edu/ws/index.php?pid=106342"
"Executive Order 10321 Amended","1952","33-Truman",FALSE,"",91,0,"10321","","http://www.presidency.ucsb.edu/ws/index.php?pid=78517"
"Providing for the Coordination by the Attorney General of Federal Law Enforcement and Crime Prevention Programs","1968","36-Johnson",FALSE,"__DOJ__",399,0,"","","http://www.presidency.ucsb.edu/ws/index.php?pid=59172"
"The Honorable Francis E. Meloy, Jr. and Robert O. Waring","1976","38-Ford",FALSE,"__war__; __economy__",157,0,"","","http://www.presidency.ucsb.edu/ws/index.php?pid=60472"
"Facilitation of Cooperative Conservation","2004","43-G. W. Bush",FALSE,"__DOI__; __EPA__; __environment__; __health__; __CEQ__",521,0,"","","http://www.presidency.ucsb.edu/ws/index.php?pid=61446"
"Amending Executive Order No. 11157 as it Relates to Incentive Pay for Hazardous Duty Involving Participation in Flight Operations on the Flight Deck of an Aircraft Carrier","1969","37-Nixon",FALSE,"__DOD__",256,0,"11157; 11242","","http://www.presidency.ucsb.edu/ws/index.php?pid=105988"
"Imports From Uganda","1979","39-Carter",FALSE,"__DOTr__; __State__",259,0,"","","http://www.presidency.ucsb.edu/ws/index.php?pid=31746"
"Creating an Emergency Board to Investigate a Dispute Between the Railway Express Agency, Inc., and Certain of Its Employees","1948","33-Truman",FALSE,"__war__",239,0,"","12553","http://www.presidency.ucsb.edu/ws/index.php?pid=78176"
"Restoring Certain Land to the Jurisdiction of the Territory of Hawaii","1947","33-Truman",FALSE,"",275,0,"","","http://www.presidency.ucsb.edu/ws/index.php?pid=60718"
"Termination of the Wage and Price Regulatory Program","1981","40-Reagan",FALSE,"",165,0,"12092","","http://www.presidency.ucsb.edu/ws/index.php?pid=44112"
"Inspection of Income, Excess-Profits, Declared Value Excess-Profits, Capital Stock, Estate, and Gift Tax Returns by the Senate Special Committee to Investigate Organized Crime in Interstate Commerce","1950","33-Truman",FALSE,"",134,0,"","10279","http://www.presidency.ucsb.edu/ws/index.php?pid=78309"
"Administration of Foreign Relations and Related Functions","1986","40-Reagan",FALSE,"__foreign__; __State__; __DOD__; __security__; __DOTr__",927,0,"12163; 11958","","http://www.presidency.ucsb.edu/ws/index.php?pid=37351"
"Creating a Board of Inquiry to Report on a Labor Dispute Affecting the Bituminous Coal Industry of the United States","1948","33-Truman",FALSE,"__foreign__; __health__",283,0,"9939","","http://www.presidency.ucsb.edu/ws/index.php?pid=78200"
"Promulgating Regulations Concerning Withholding of Compensation of Civilian Employees of the National Guard for State and State-Sponsored Employee Retirement, Disability, or Death Benefits Programs","1962","35-Kennedy",FALSE,"__DOD__",858,0,"10679","","http://www.presidency.ucsb.edu/ws/index.php?pid=58934"
"Amendment of Executive Order 9805 Prescribing Regulations Governing Payment of Certain Travel and Transportation Expenses","1950","33-Truman",FALSE,"__economy__; __foreign__",1590,0,"9805; 9933; 9997; 10069","10274; 10507; 11012","http://www.presidency.ucsb.edu/ws/index.php?pid=78287"
"Providing Assistance for the Removal of an Obstruction of Justice Within the State of Arkansas","1957","34-Eisenhower",FALSE,"__DOD__",566,0,"","","http://www.presidency.ucsb.edu/ws/index.php?pid=75572"
"Amending Executive Order No. 11649, Regulations Governing the Seals of the President and the Vice President of the United States","1976","38-Ford",FALSE,"",75,0,"11649","","http://www.presidency.ucsb.edu/ws/index.php?pid=23656"
"Federal Emergency Management Agency","1979","39-Carter",FALSE,"__OMB__; __DOC__; __HUD__",557,0,"12046","","http://www.presidency.ucsb.edu/ws/index.php?pid=32127"
"President's Task Force on Market Mechanisms","1987","40-Reagan",FALSE,"",93,0,"12614","","http://www.presidency.ucsb.edu/ws/index.php?pid=33871"
"Observance of Holidays by Government Agencies","1952","33-Truman",FALSE,"",471,0,"9636","10508; 10523; 10580; 10744; 10792; 10825; 10856; 11064; 11226; 11272; 11503; 11573; 11582","http://www.presidency.ucsb.edu/ws/index.php?pid=78468"
"Inspection of Income, Excess-Profits, Estate, and Gift Tax Returns by the Senate Committee on Government Operations","1967","36-Johnson",FALSE,"__economy__; __DOTr__",207,0,"","","http://www.presidency.ucsb.edu/ws/index.php?pid=106079"
"Creating an Emergency Board to Investigate a Dispute Between the Monongahela Connecting Railroad Company and Certain of Its Employees","1949","33-Truman",FALSE,"",257,0,"","12553","http://www.presidency.ucsb.edu/ws/index.php?pid=78266"
"Amendment to Executive Order 13045, Extending the Task Force on Environmental Health Risks and Safety Risks to Children","2001","43-G. W. Bush",FALSE,"__environment__; __health__",120,0,"13045","","http://www.presidency.ucsb.edu/ws/index.php?pid=61510"
"Half-Day Closing of Executive Departments and Agencies of the Federal Government on Tuesday, December 24, 2002","2002","43-G. W. Bush",FALSE,"__security__",211,0,"11582","","http://www.presidency.ucsb.edu/ws/index.php?pid=61348"
"Establishing an Emergency Board To Investigate a Dispute Between the Soo Line Railroad Company and Certain of Its Employees Represented by the United Transportation Union","1994","42-Clinton",FALSE,"",332,0,"","","http://www.presidency.ucsb.edu/ws/index.php?pid=49033"
"Specification of Laws from Which the Escapee Program Administered by the Department of State Shall Be Exempt","1952","33-Truman",FALSE,"__State__; __security__",170,0,"","10446","http://www.presidency.ucsb.edu/ws/index.php?pid=78510"
"Sale of Certain Combatant Vessels of the Navy","1945","33-Truman",FALSE,"",139,0,"","9986","http://www.presidency.ucsb.edu/ws/index.php?pid=77854"
"Extension of the President's Commission on Registration and Voting Participation","1963","36-Johnson",FALSE,"",67,0,"11100","","http://www.presidency.ucsb.edu/ws/index.php?pid=106288"
"Establishing the President's Foreign Intelligence Advisory Board","1961","35-Kennedy",FALSE,"__foreign__; __security__; __CIA__",353,0,"10656","11460","http://www.presidency.ucsb.edu/ws/index.php?pid=58876"
