"title","year","president","st.flag","matchWords","word.count","stMatchRatio","eoMatches.out","eoMatches.in","link"
"Amending the Selective Service Regulations","1948","33-Truman",TRUE,"__foreign__; __State__; __science/research__; __health__; __education__",1221,0.000819000819000819,"9979; 9988","10008; 10202; 10232; 10292; 12553","http://www.presidency.ucsb.edu/ws/index.php?pid=78214"
"Responsibilities of the Departments of Commerce and Veterans Affairs and the Small Business Administration With Respect to Faith-Based and Community Initiatives","2004","43-G. W. Bush",TRUE,"__DOC__; __innovation__; __computing__",842,0.00237529691211401,"","","http://www.presidency.ucsb.edu/ws/index.php?pid=61436"
"Termination of Emergency With Respect to the Risk of Nuclear Proliferation Created by the Accumulation of a Large Volume of Weapons-Usable Fissile Material in the Territory of the Russian Federation","2015","44-Obama",TRUE,"__nuclear__; __economy__",345,0.0115942028985507,"13617","","http://www.presidency.ucsb.edu/ws/index.php?pid=110240"
"Providing for the Reservation of Rights to Fissionable Materials in Lands Owned By the United States","1946","33-Truman",TRUE,"__DOI__; __nuclear__; __energy__; __war__",1099,0.00363967242948135,"9613","10596; 9908","http://www.presidency.ucsb.edu/ws/index.php?pid=77996"
"Presidential Advisory Council on HIV/AIDS","1995","42-Clinton",TRUE,"__HHS__; __science/research__; __GSA__",467,0.00214132762312634,"","13009","http://www.presidency.ucsb.edu/ws/index.php?pid=51495"
"Prohibiting Certain Transactions With Respect to Iran","1997","42-Clinton",TRUE,"__economy__; __security__; __foreign__; __technology__; __DOTr__; __State__",1568,0.0076530612244898,"12957; 12959; 12613","13628","http://www.presidency.ucsb.edu/ws/index.php?pid=54554"
"Establishing the President's Advisory Committee on Labor-Management Policy","1961","35-Kennedy",TRUE,"__DOL__; __DOC__; __technology__",389,0.0025706940874036,"","11710","http://www.presidency.ucsb.edu/ws/index.php?pid=58856"
"Management Reform in the Federal Government","1984","40-Reagan",TRUE,"__OMB__; __USDA__; __DOC__; __DOD__; __DOEd__; __DOE__; __budget__; __HHS__; __HUD__; __DOI__; __DOJ__; __DOL__; __State__; __DOT__; __DOTr__; __EPA__; __GSA__; __NASA__",806,0.00248138957816377,"","12816; 13048","http://www.presidency.ucsb.edu/ws/index.php?pid=39968"
"Prescribing a New Part of the Selective Service Regulations","1967","36-Johnson",TRUE,"__health__; __DOJ__; __medical__",1984,0.00100806451612903,"","12553","http://www.presidency.ucsb.edu/ws/index.php?pid=106113"
"Department of Energy","1978","39-Carter",TRUE,"__DOE__; __energy__; __science/research__; __DOI__; __AEC__; __ERDA__; __NRC__; __security__; __nuclear__; __foreign__; __GSA__; __OMB__",1582,0.0436156763590392,"11647; 11790; 11912; 10485; 11969; 11331; 11177; 10127; 10865; 10899; 11057; 11477; 11752; 11761; 11652; 11902; 11905; 11345; 11371; 11578; 11658; 11659; 10480; 11030; 11490; 12009","12140; 12153; 12156; 12187; 12189; 12209; 12287","http://www.presidency.ucsb.edu/ws/index.php?pid=30050"
"Interagency Employee Benefit Council","1981","39-Carter",TRUE,"__security__; __DOTr__; __DOJ__; __DOC__; __DOL__; __HHS__; __OMB__; __economy__; __science/research__",504,0.00198412698412698,"","12379","http://www.presidency.ucsb.edu/ws/index.php?pid=44476"
"Designating the European Space Research Organization (ESRO) as a Public International Organization Entitled to Enjoy Certain Privileges, Exemptions, and Immunities","1974","37-Nixon",TRUE,"__science/research__",103,0.0194174757281553,"11318; 11351","12766","http://www.presidency.ucsb.edu/ws/index.php?pid=106783"
"Designating Facilities in Florida as the John F. Kennedy Space Center","1963","36-Johnson",TRUE,"__NASA__",165,0.00606060606060606,"","","http://www.presidency.ucsb.edu/ws/index.php?pid=26010"
"Superfund Implementation","1987","40-Reagan",TRUE,"__environment__; __State__; __DOD__; __DOJ__; __DOI__; __USDA__; __DOC__; __DOL__; __HHS__; __DOT__; __DOE__; __EPA__; __NRC__; __OMB__; __health__; __energy__; __DOTr__; __budget__",3617,0.00165883328725463,"12088; 12316","12777; 13016; 13286; 13308","http://www.presidency.ucsb.edu/ws/index.php?pid=34374"
"Continuation of Export Control Regulations","1994","42-Clinton",TRUE,"__economy__; __foreign__; __technology__; __security__; __DOC__",665,0.00150375939849624,"12002; 12755; 12214; 12735; 12851","12924","http://www.presidency.ucsb.edu/ws/index.php?pid=50413"
"Creating an Emergency Board to Investigate a Dispute Between Eastern Air Lines, Inc., and Certain of its Employees","1962","35-Kennedy",TRUE,"__engineering__",231,0.00432900432900433,"","12553","http://www.presidency.ucsb.edu/ws/index.php?pid=58945"
"Permitting Certain Qualified Employees of the National Aeronautics and Space Administration to be Given Career or Career-Conditional Appointment","1977","38-Ford",TRUE,"__NASA__",297,0.0134680134680135,"","12107","http://www.presidency.ucsb.edu/ws/index.php?pid=59208"
"Termination of the Office of Strategic Services and Disposition of Its Functions","1945","33-Truman",TRUE,"__war__; __science/research__; __State__; __OMB__; __DOD__",689,0.00435413642960813,"","9652","http://www.presidency.ucsb.edu/ws/index.php?pid=60673"
"Prohibiting Certain Transactions With Respect to Iran","1995","42-Clinton",TRUE,"__economy__; __security__; __foreign__; __technology__; __DOTr__; __State__",1203,0.00249376558603491,"12957; 12613","13059; 13628","http://www.presidency.ucsb.edu/ws/index.php?pid=51326"
"International Council on Archives-Bicentennial Year Meeting","1974","38-Ford",TRUE,"__education__; __GSA__; __computing__",206,0.00485436893203883,"","","http://www.presidency.ucsb.edu/ws/index.php?pid=23904"
"Continuance of Certain Federal Advisory Committees","2011","44-Obama",TRUE,"__DOI__; __science/research__; __NSF__; __health__; __DOL__; __DOC__; __art__; __security__; __DHS__; __environment__; __HHS__; __university__; __DOEd__; __GSA__; __USDA__; __DOE__",955,0.00837696335078534,"11145; 11183; 11287; 11612; 12131; 12216; 12367; 12382; 12829; 12905; 12994; 13231; 13265; 13270; 13515; 13511","13592; 13652","http://www.presidency.ucsb.edu/ws/index.php?pid=96846"
"Providing for the Protection Abroad of Inventions Resulting from Research Financed by the Government","1947","33-Truman",TRUE,"__science/research__; __foreign__; __DOC__; __health__; __State__; __economy__; __AEC__; __security__",699,0.0100143061516452,"9568; 9604; 9809","10096","http://www.presidency.ucsb.edu/ws/index.php?pid=59309"
"Motor Vehicles","1982","40-Reagan",TRUE,"__GSA__; __economy__; __energy__; __DOT__; __DOE__",355,0.00563380281690141,"11912","","http://www.presidency.ucsb.edu/ws/index.php?pid=42823"
"National Nutrition Monitoring Advisory Council","1991","41-H.W. Bush",TRUE,"__science/research__; __USDA__; __HHS__; __health__; __medical__; __education__; __technology__; __engineering__; __economy__; __GSA__",990,0.0121212121212121,"","","http://www.presidency.ucsb.edu/ws/index.php?pid=23586"
"Amendment of Executive Orders, and Other Actions, in Connection With the Transfer of Certain Functions to the Secretary of Homeland Security","2003","43-G. W. Bush",TRUE,"__DHS__; __security__; __DOJ__; __environment__; __DOD__; __DOTr__; __GSA__; __HHS__; __technology__; __economy__; __OMB__; __energy__; __DOT__; __computing__; __DOEd__; __CIA__; __DOI__; __DOE__; __VA__; __nuclear__; __NSC__; __science/research__; __foreign__; __budget__; __war__",7549,0.00198701814809909,"13276; 13274; 13271; 13260; 13257; 13254; 13231; 13130; 13228; 13223; 13212; 13165; 13154; 13133; 13120; 13112; 13100; 13076; 13011; 12989; 12985; 12982; 12978; 12977; 12919; 12906; 12870; 12835; 12830; 12824; 12807; 12793; 12789; 12788; 12777; 12743; 12742; 12733; 12728; 12727; 12699; 12657; 12656; 12580; 12555; 12501; 12472; 12382; 12341; 12208; 12188; 12160; 12148; 12146; 12002; 11965; 11926; 11858; 11800; 11645; 11623; 11448; 11446; 11438; 11366; 11239; 12234; 11231; 11190; 11139; 11079; 11046; 11016; 10977; 10789; 10694; 10637; 10631; 10554; 10499; 10448; 10271; 10179; 10163; 10113; 12333; 13284","13362; 13373; 13442; 13587","http://www.presidency.ucsb.edu/ws/index.php?pid=61382"
"Adjustments of Certain Rates of Pay and Allowances","1976","38-Ford",TRUE,"__foreign__; __medical__",409,0.00244498777506112,"11883","11943; 12010","http://www.presidency.ucsb.edu/ws/index.php?pid=23683"
"Amendment to Executive Order No. 12873","1996","42-Clinton",TRUE,"__computing__; __environment__; __CEQ__",291,0.00343642611683849,"12873","","http://www.presidency.ucsb.edu/ws/index.php?pid=52589"
"President's Council of Advisors on Science and Technology","1990","41-H.W. Bush",TRUE,"__PCAST__; __science/research__; __technology__; __OSTP__; __GSA__",441,0.0294784580498866,"","12768; 12869; 12882","http://www.presidency.ucsb.edu/ws/index.php?pid=23546"
"Authorization for the Communication of Restricted Data by the Department of State","1962","35-Kennedy",TRUE,"__State__; __nuclear__; __energy__; __AEC__; __DOD__",254,0.0196850393700787,"10841","12038","http://www.presidency.ucsb.edu/ws/index.php?pid=58996"
"Science and Technology Policy Functions","1978","39-Carter",TRUE,"__technology__; __science/research__; __budget__; __OSTP__; __NSF__; __engineering__; __OMB__",919,0.0522306855277476,"","12399","http://www.presidency.ucsb.edu/ws/index.php?pid=30416"
"Trails for America in the 21st Century","2001","42-Clinton",TRUE,"__education__; __USDA__; __DOI__; __DOT__; __technology__",919,0.00108813928182807,"","","http://www.presidency.ucsb.edu/ws/index.php?pid=61683"
"Controlled Unclassified Information","2010","44-Obama",TRUE,"__nuclear__; __energy__; __security__; __OMB__; __NIST__; __budget__; __DOJ__",1254,0.00239234449760766,"13526","13587","http://www.presidency.ucsb.edu/ws/index.php?pid=88676"
"Federal Civilian and Military Pay Increases","1979","39-Carter",TRUE,"__foreign__; __medical__",420,0.00238095238095238,"12087","12200; 12248","http://www.presidency.ucsb.edu/ws/index.php?pid=31496"
"Enhancing Coordination of National Efforts in the Arctic","2015","44-Obama",TRUE,"__economy__; __energy__; __environment__; __science/research__; __war__; __OSTP__; __CEQ__; __NSC__; __State__; __HHS__; __security__; __EPA__; __NASA__; __NSF__; __OMB__; __budget__",1508,0.00862068965517241,"","","http://www.presidency.ucsb.edu/ws/index.php?pid=109268"
"National Defense Industrial Resources Preparedness","1994","42-Clinton",TRUE,"__energy__; __security__; __technology__; __science/research__; __NSC__; __USDA__; __DOE__; __HHS__; __health__; __DOT__; __DOD__; __DOC__; __foreign__; __war__; __DOTr__; __OMB__; __DOI__; __budget__; __GSA__; __DOL__; __State__; __DOJ__; __nuclear__",5278,0.00795755968169761,"12472; 10789; 10222; 10480; 10647; 11179; 11355; 11912; 12148; 12521; 12649; 12773; 11790","13286; 13456; 13603","http://www.presidency.ucsb.edu/ws/index.php?pid=50295"
"Amending the Order of Succession Within the Department of Agriculture","2009","43-G. W. Bush",TRUE,"__USDA__; __foreign__; __environment__; __science/research__; __education__; __economy__",407,0.00245700245700246,"13241","","http://www.presidency.ucsb.edu/ws/index.php?pid=85410"
"Amending Executive Order 13257 To Implement the Trafficking Victims Protection Reauthorization Act of 2003","2004","43-G. W. Bush",TRUE,"__State__; __foreign__; __DHS__; __DOC__; __science/research__; __security__",747,0.00267737617135207,"13257","","http://www.presidency.ucsb.edu/ws/index.php?pid=61427"
"Creating an Emergency Board to Investigate a Dispute Between the Wabash Railroad Company and the Ann Arbor Railroad Company and Certain of Their Employees","1949","33-Truman",TRUE,"__engineering__",252,0.00396825396825397,"","12553","http://www.presidency.ucsb.edu/ws/index.php?pid=78240"
"Alaska Natural Gas Transportation System","1979","39-Carter",TRUE,"__USDA__; __energy__; __EPA__; __engineering__",589,0.00509337860780985,"11222","","http://www.presidency.ucsb.edu/ws/index.php?pid=32510"
"Prescribing Responsibilities of the Office of Emergency Planning in the Executive Office of the President","1962","35-Kennedy",TRUE,"__war__; __security__; __economy__; __foreign__; __science/research__; __medical__; __nuclear__; __OMB__; __GSA__; __DOD__",4004,0.00124875124875125,"10421; 10952; 10958; 10660; 10705; 10480; 10900; 10582; 10427; 10737; 10995; 11030; 10296; 10312; 10346; 10494; 10601; 10634; 10242; 10260; 10529; 10789; 9981; 10219; 10269; 10438; 10461; 10524; 10539; 10638; 10773; 10782; 10902","11075; 11092; 11093; 11490; 11556; 11610; 11725; 11794; 12046; 12148; 12473","http://www.presidency.ucsb.edu/ws/index.php?pid=58990"
"Further Amending Executive Order 10789 Authorizing Agencies of the Government to Exercise Certain Contracting Authority in Connection with National Defense Functions and Prescribing Regulations Governing the Exercise of Such Authority","1971","37-Nixon",TRUE,"__nuclear__; __DOD__",790,0.00126582278481013,"10789; 11051; 11382","","http://www.presidency.ucsb.edu/ws/index.php?pid=106659"
"Prescribing Procedures Governing Interdepartmental Cash Awards to the Members of the Armed Forces","1968","36-Johnson",TRUE,"__science/research__; __economy__; __DOT__; __DOD__",494,0.0121457489878543,"","12107; 13286","http://www.presidency.ucsb.edu/ws/index.php?pid=59176"
"Addition to Level IV of the Executive Schedule","1991","41-H.W. Bush",TRUE,"__NIH__",86,0.0116279069767442,"12154","","http://www.presidency.ucsb.edu/ws/index.php?pid=23597"
"Blocking Property of Certain Persons With Respect to Human Rights Abuses in Syria","2011","44-Obama",TRUE,"__economy__; __security__; __foreign__; __DOTr__; __State__; __technology__; __war__",1125,0.000888888888888889,"13338; 13399; 13460","13573; 13582","http://www.presidency.ucsb.edu/ws/index.php?pid=90318"
"Assigning Emergency Preparedness Functions to the Secretary of State","1963","35-Kennedy",TRUE,"__State__; __foreign__; __war__; __economy__; __DOC__; __science/research__",723,0.00276625172890733,"","11490","http://www.presidency.ucsb.edu/ws/index.php?pid=59026"
"Prescribing a Portion of the Selective Service Regulations","1952","33-Truman",TRUE,"__health__; __education__; __science/research__; __DOJ__",2292,0.00043630017452007,"","10420; 10837; 10984; 12553","http://www.presidency.ucsb.edu/ws/index.php?pid=78508"
"Blocking Property of Transnational Criminal Organizations","2011","44-Obama",TRUE,"__economy__; __foreign__; __security__; __DOTr__; __DOJ__; __State__; __technology__; __war__",1235,0.000809716599190283,"","","http://www.presidency.ucsb.edu/ws/index.php?pid=90663"
"Blocking Property of Persons Threatening the Peace, Security, or Stabilization of Burma","2012","44-Obama",TRUE,"__security__; __economy__; __foreign__; __DOTr__; __State__; __technology__",1415,0.00212014134275618,"13047; 13448; 13310; 13464","13651","http://www.presidency.ucsb.edu/ws/index.php?pid=101361"
"Designating Certain Agencies Pursuant to Section 103 (a) of the Renenogiation Act of 1951","1951","33-Truman",TRUE,"__NASA__",190,0.00526315789473684,"","10773; 11051","http://www.presidency.ucsb.edu/ws/index.php?pid=78405"
"Public International Organizations Entitled To Enjoy Privileges, Exemptions, and Immunities","1982","40-Reagan",TRUE,"__science/research__; __foreign__",232,0.00431034482758621,"","","http://www.presidency.ucsb.edu/ws/index.php?pid=42436"
"Compensation for Damages Involving Nuclear Reactors of United States Warships","1976","38-Ford",TRUE,"__nuclear__; __war__; __DOD__; __OMB__; __DOJ__; __State__; __foreign__",333,0.015015015015015,"","","http://www.presidency.ucsb.edu/ws/index.php?pid=59202"
"Conservation of Petroleum and Natural Gas","1979","39-Carter",TRUE,"__OMB__; __DOE__",652,0.00460122699386503,"","","http://www.presidency.ucsb.edu/ws/index.php?pid=31844"
"Further Amendment to Executive Order 12958, as Amended, Classified National Security Information","2003","43-G. W. Bush",TRUE,"__security__; __foreign__; __science/research__; __technology__; __economy__; __nuclear__; __art__; __war__; __State__; __DOD__; __energy__; __education__; __CIA__; __computing__",8721,0.00149065474142874,"12958","13526","http://www.presidency.ucsb.edu/ws/index.php?pid=61388"
"Adjusting Rates of Pay for Certain Statutory Schedules","1969","37-Nixon",TRUE,"__medical__; __foreign__",1030,0.00388349514563107,"","11811","http://www.presidency.ucsb.edu/ws/index.php?pid=106009"
"Authorizing the Secretary of the Navy to Take Possession of Anf to Operate the Plants and Facilities of the United Engineering Company, Ltd. Located At San Francisco, California","1945","33-Truman",TRUE,"__DOD__; __engineering__; __war__; __DOJ__; __DOL__",875,0.00342857142857143,"","9603","http://www.presidency.ucsb.edu/ws/index.php?pid=77903"
"Amending the Selective Service Regulations","1967","36-Johnson",TRUE,"__war__; __DOJ__; __health__; __medical__",2200,0.00727272727272727,"9988; 10001; 10008; 10116; 10202; 10292; 10363; 10659; 10714; 10984; 11188","11360; 11586; 12553","http://www.presidency.ucsb.edu/ws/index.php?pid=106088"
"Revocation of Executive Order No. 9908 of December 5, 1947","1955","34-Eisenhower",TRUE,"__nuclear__; __energy__; __AEC__",388,0.0283505154639175,"9908; 9701","","http://www.presidency.ucsb.edu/ws/index.php?pid=106399"
"Amendment of Paragraphs 76a and 127c of the Manual for Courts-Martial, United States, 1951","1954","34-Eisenhower",TRUE,"__computing__",322,0.0031055900621118,"10214","10628","http://www.presidency.ucsb.edu/ws/index.php?pid=106476"
"Amendment of Executive Order 7397 of June 20, 1936, as Amended, Establishing the Federal Fire Council","1951","33-Truman",TRUE,"__GSA__; __engineering__",298,0.00335570469798658,"9594","11654","http://www.presidency.ucsb.edu/ws/index.php?pid=78402"
"Establishment of Emergency Board No. 201 To Investigate a Railroad Labor Dispute","1983","40-Reagan",TRUE,"__engineering__",397,0.00251889168765743,"","12553","http://www.presidency.ucsb.edu/ws/index.php?pid=41135"
"Greening the Government Through Leadership in Environmental Management","2000","42-Clinton",TRUE,"__environment__; __health__; __innovation__; __economy__; __budget__; __OMB__; __EPA__; __CEQ__; __USDA__; __DOD__; __GSA__; __security__; __NSC__; __energy__",6324,0.00047438330170778,"11050; 13109; 13101; 12856; 12088; 12843; 12969; 13123; 13134","13327; 13423; 13693","http://www.presidency.ucsb.edu/ws/index.php?pid=61641"
"Creating a Board of Inquiry to Report on Certain Labor Disputes Affecting the Military Jet Engine Industry, Military Aircraft Industry, Military Armament Industry and Military Electronics Industry of the United States","1966","36-Johnson",TRUE,"__engineering__; __war__; __foreign__",573,0.00349040139616056,"","12553","http://www.presidency.ucsb.edu/ws/index.php?pid=105775"
"Prescribing the Manual for Courts-Martial, United States, 1951","1951","33-Truman",TRUE,"__war__; __art__; __health__; __education__; __DOD__; __foreign__; __security__; __science/research__; __computing__; __math__",52112,9.59471906662573e-05,"","10247; 10256; 10565; 10652; 11009; 11081; 11317","http://www.presidency.ucsb.edu/ws/index.php?pid=78370"
"Responses to Environmental Damage","1981","40-Reagan",TRUE,"__environment__; __State__; __DOD__; __DOJ__; __DOI__; __USDA__; __DOC__; __DOL__; __HHS__; __DOT__; __DOE__; __EPA__; __NRC__; __OMB__; __health__; __DOTr__; __budget__",1874,0.00106723585912487,"12291; 12286","12418; 12580","http://www.presidency.ucsb.edu/ws/index.php?pid=44165"
"Continuance of Certain Federal Advisory Committees and Amendments to Executive Orders 13038 and 13054","1997","42-Clinton",TRUE,"__DOI__; __health__; __DOL__; __education__; __DOEd__; __university__; __PCAST__; __OSTP__; __art__; __science/research__; __NSF__; __HHS__; __DOC__; __security__; __DOD__; __environment__; __GSA__",661,0.00907715582450832,"13038; 13054; 11145; 12196; 12871; 12900; 12876; 11183; 12882; 12367; 12216; 11287; 12994; 12345; 12131; 12832; 12905; 12891; 12964; 12987; 13032; 12946; 12864; 12890; 12921; 12970; 13015; 12974; 12721","13065; 13138","http://www.presidency.ucsb.edu/ws/index.php?pid=54692"
"Federal Regional Councils","1979","39-Carter",TRUE,"__OMB__; __DOI__; __USDA__; __DOC__; __DOL__; __health__; __education__; __HUD__; __DOT__; __DOE__; __EPA__; __GSA__; __engineering__; __economy__",787,0.00254129606099111,"11647","12314","http://www.presidency.ucsb.edu/ws/index.php?pid=32630"
"Establishing the President's Advisory Council on Cost Reduction","1967","36-Johnson",TRUE,"__economy__; __OMB__; __DOD__; __GSA__; __science/research__",574,0.00174216027874564,"","11418; 11509","http://www.presidency.ucsb.edu/ws/index.php?pid=106091"
"Providing Compensation to Americas Nuclear Weapons Workers","2000","42-Clinton",TRUE,"__nuclear__; __energy__; __war__; __science/research__; __DOE__; __DOL__; __HHS__; __DOJ__; __health__; __OMB__; __economy__; __medical__; __budget__",2030,0.0231527093596059,"","13699","http://www.presidency.ucsb.edu/ws/index.php?pid=61668"
"Federal Procurement Reform","1994","42-Clinton",TRUE,"__innovation__; __education__; __technology__; __OMB__",587,0.00681431005110733,"12352","","http://www.presidency.ucsb.edu/ws/index.php?pid=49274"
"Placing Certain Positions in Levels IV and V of the Executive Schedule","1973","37-Nixon",TRUE,"__health__; __education__; __NIH__; __DOJ__; __OMB__; __DOD__; __science/research__; __engineering__; __DOL__; __DOC__; __security__; __GSA__; __HUD__",352,0.00852272727272727,"11248","11715; 11727; 11736; 11768","http://www.presidency.ucsb.edu/ws/index.php?pid=106749"
"Conforming the Central Intellegence Agency and Civil Service Retirement and Disability Systems","1989","41-H.W. Bush",TRUE,"__CIA__; __computing__",366,0.00273224043715847,"","","http://www.presidency.ucsb.edu/ws/index.php?pid=23532"
"Amending Executive Order No. 11652 Relating to Classification and Declassification of National Security Information and Material","1975","38-Ford",TRUE,"__security__; __energy__; __AEC__; __ERDA__; __NRC__",170,0.0470588235294118,"11652","12065","http://www.presidency.ucsb.edu/ws/index.php?pid=23933"
"Improving the Security of Consumer Financial Transactions","2014","44-Obama",TRUE,"__security__; __economy__; __innovation__; __technology__; __OMB__; __DOTr__; __computing__; __GSA__; __DOJ__; __DHS__; __DOC__; __NSC__; __OSTP__; __budget__",968,0.0103305785123967,"","","http://www.presidency.ucsb.edu/ws/index.php?pid=107786"
"Reservation of Source Material in Certain Lands Owned by the United States","1947","33-Truman",TRUE,"__nuclear__; __energy__; __AEC__",594,0.0117845117845118,"9701; 9613","10596","http://www.presidency.ucsb.edu/ws/index.php?pid=78153"
"Federal Facility Ridesharing Program","1980","39-Carter",TRUE,"__economy__; __OMB__; __GSA__; __DOT__; __DOE__; __energy__; __EPA__",605,0.00495867768595041,"","","http://www.presidency.ucsb.edu/ws/index.php?pid=32887"
"President's Commission on Industrial Competitiveness","1983","40-Reagan",TRUE,"__technology__; __DOC__; __GSA__",419,0.00954653937947494,"","12440; 12457; 12534","http://www.presidency.ucsb.edu/ws/index.php?pid=41529"
"Delegating to the Administrator of Veterans' Affairs Certain Authority Relating to Grants-in-Aid to the Republic of the Philippines for Medical Care and Treatment of Veterans","1974","37-Nixon",TRUE,"__medical__; __health__; __State__; __OMB__",229,0.00436681222707424,"","","http://www.presidency.ucsb.edu/ws/index.php?pid=59126"
"Regulations Governing Payment of Disability Retirement Pay, Hospitalization, and Re-Examination of Members and Former Members of the Uniformed Services","1950","33-Truman",TRUE,"__DOD__; __security__; __medical__; __health__; __war__",892,0.00224215246636771,"9703","10400; 11733","http://www.presidency.ucsb.edu/ws/index.php?pid=59325"
"Providing for the Performance of Certain Functions Heretofore Performed by the President With Respect to Electric Power and Natural Gas Facilities Located on the Borders of the United States","1953","34-Eisenhower",TRUE,"__energy__; __foreign__; __State__; __DOD__",599,0.00500834724540901,"","11423; 12038; 12847; 13337","http://www.presidency.ucsb.edu/ws/index.php?pid=59222"
"Directing the Secretary of Commerce to Take Possession of and Operate the Plants and Facilities of Certain Steel Companies","1952","33-Truman",TRUE,"__DOC__; __security__; __AEC__; __economy__; __war__",1733,0.000577034045008655,"10233","","http://www.presidency.ucsb.edu/ws/index.php?pid=78454"
"Improving Government Program Performance","2007","43-G. W. Bush",TRUE,"__OMB__; __budget__; __computing__; __security__",1707,0.00234329232571763,"9703","","http://www.presidency.ucsb.edu/ws/index.php?pid=76043"
